{
  "format": "aw-chim-cells-1",
  "reason": "Every exterior cell of Vvardenfell on CHIM, the default of a CHIM build (tools/build.py --builder chim with no --chim-regions): the 1,404 exterior cells of the game data plus 5 open-sea cells without a cell record (they get a routing row). The release builds of v0.0.43 to v0.0.47-dev2 used the same cells minus the 15 that lie wholly inside a town frame (Balmora, Vivec); those are on CHIM as part of their town frame, and the build preflight lists them as dropped, so the cells built are the same.",
  "notes": "Made with tools/chim_cell_list.py for v0.0.43 (batch 5): the earlier batches, 14 open-sea cells and 39 cells whose stair collision was fixed (CHIM-STAIR-STEPS-SOLID-43); the 15 town-frame cells added for v0.0.47 (BUILD-CHIM-CELLS-PRIVATE-LIST-47). --chim-regions none builds with no CHIM region cells (the earlier default); --chim-regions @FILE selects another list (docs/chim/CHIM_REGIONS.md).",
  "cells": [
    [-19, 14],
    [-19, 15],
    [-18, 10],
    [-18, 11],
    [-18, 12],
    [-18, 13],
    [-18, 14],
    [-18, 15],
    [-17, 9],
    [-17, 10],
    [-17, 11],
    [-17, 12],
    [-17, 13],
    [-17, 14],
    [-17, 15],
    [-17, 16],
    [-16, 7],
    [-16, 8],
    [-16, 9],
    [-16, 10],
    [-16, 11],
    [-16, 12],
    [-16, 13],
    [-16, 14],
    [-16, 15],
    [-16, 16],
    [-16, 17],
    [-15, -8],
    [-15, 7],
    [-15, 8],
    [-15, 9],
    [-15, 10],
    [-15, 11],
    [-15, 12],
    [-15, 13],
    [-15, 14],
    [-15, 15],
    [-15, 16],
    [-15, 17],
    [-14, 2],
    [-14, 4],
    [-14, 5],
    [-14, 6],
    [-14, 7],
    [-14, 8],
    [-14, 9],
    [-14, 10],
    [-14, 11],
    [-14, 12],
    [-14, 13],
    [-14, 14],
    [-14, 15],
    [-14, 16],
    [-14, 17],
    [-13, 1],
    [-13, 2],
    [-13, 3],
    [-13, 4],
    [-13, 5],
    [-13, 6],
    [-13, 7],
    [-13, 8],
    [-13, 9],
    [-13, 10],
    [-13, 11],
    [-13, 12],
    [-13, 13],
    [-13, 14],
    [-13, 15],
    [-13, 16],
    [-13, 17],
    [-13, 18],
    [-12, 1],
    [-12, 2],
    [-12, 3],
    [-12, 4],
    [-12, 5],
    [-12, 6],
    [-12, 7],
    [-12, 8],
    [-12, 9],
    [-12, 10],
    [-12, 11],
    [-12, 12],
    [-12, 13],
    [-12, 14],
    [-12, 15],
    [-12, 16],
    [-12, 17],
    [-12, 18],
    [-12, 19],
    [-12, 20],
    [-11, -1],
    [-11, 0],
    [-11, 1],
    [-11, 2],
    [-11, 3],
    [-11, 4],
    [-11, 5],
    [-11, 6],
    [-11, 7],
    [-11, 8],
    [-11, 9],
    [-11, 10],
    [-11, 11],
    [-11, 12],
    [-11, 13],
    [-11, 14],
    [-11, 15],
    [-11, 16],
    [-11, 17],
    [-11, 18],
    [-11, 19],
    [-11, 20],
    [-10, -9],
    [-10, -8],
    [-10, -7],
    [-10, -6],
    [-10, -5],
    [-10, -4],
    [-10, -3],
    [-10, -2],
    [-10, -1],
    [-10, 0],
    [-10, 1],
    [-10, 2],
    [-10, 3],
    [-10, 4],
    [-10, 5],
    [-10, 6],
    [-10, 7],
    [-10, 8],
    [-10, 9],
    [-10, 10],
    [-10, 11],
    [-10, 12],
    [-10, 13],
    [-10, 14],
    [-10, 15],
    [-10, 16],
    [-10, 17],
    [-10, 18],
    [-10, 19],
    [-10, 20],
    [-9, -14],
    [-9, -13],
    [-9, -12],
    [-9, -11],
    [-9, -10],
    [-9, -9],
    [-9, -8],
    [-9, -7],
    [-9, -6],
    [-9, -5],
    [-9, -4],
    [-9, -3],
    [-9, -2],
    [-9, -1],
    [-9, 0],
    [-9, 1],
    [-9, 2],
    [-9, 3],
    [-9, 4],
    [-9, 5],
    [-9, 6],
    [-9, 7],
    [-9, 8],
    [-9, 9],
    [-9, 10],
    [-9, 11],
    [-9, 12],
    [-9, 13],
    [-9, 14],
    [-9, 15],
    [-9, 16],
    [-9, 17],
    [-9, 18],
    [-9, 19],
    [-9, 20],
    [-8, -14],
    [-8, -13],
    [-8, -12],
    [-8, -11],
    [-8, -10],
    [-8, -9],
    [-8, -8],
    [-8, -7],
    [-8, -6],
    [-8, -5],
    [-8, -4],
    [-8, -3],
    [-8, -2],
    [-8, -1],
    [-8, 0],
    [-8, 1],
    [-8, 2],
    [-8, 3],
    [-8, 4],
    [-8, 5],
    [-8, 6],
    [-8, 7],
    [-8, 8],
    [-8, 9],
    [-8, 10],
    [-8, 11],
    [-8, 12],
    [-8, 13],
    [-8, 14],
    [-8, 15],
    [-8, 16],
    [-8, 17],
    [-8, 18],
    [-8, 19],
    [-8, 20],
    [-8, 21],
    [-8, 22],
    [-7, -14],
    [-7, -13],
    [-7, -12],
    [-7, -11],
    [-7, -10],
    [-7, -9],
    [-7, -8],
    [-7, -7],
    [-7, -6],
    [-7, -5],
    [-7, -4],
    [-7, -3],
    [-7, -2],
    [-7, -1],
    [-7, 0],
    [-7, 1],
    [-7, 2],
    [-7, 3],
    [-7, 4],
    [-7, 5],
    [-7, 6],
    [-7, 7],
    [-7, 8],
    [-7, 9],
    [-7, 10],
    [-7, 11],
    [-7, 12],
    [-7, 13],
    [-7, 14],
    [-7, 15],
    [-7, 16],
    [-7, 17],
    [-7, 18],
    [-7, 19],
    [-7, 20],
    [-7, 21],
    [-7, 22],
    [-7, 23],
    [-7, 24],
    [-6, -14],
    [-6, -13],
    [-6, -12],
    [-6, -11],
    [-6, -10],
    [-6, -9],
    [-6, -8],
    [-6, -7],
    [-6, -6],
    [-6, -5],
    [-6, -4],
    [-6, -3],
    [-6, -2],
    [-6, -1],
    [-6, 0],
    [-6, 1],
    [-6, 2],
    [-6, 3],
    [-6, 4],
    [-6, 5],
    [-6, 6],
    [-6, 7],
    [-6, 8],
    [-6, 9],
    [-6, 10],
    [-6, 11],
    [-6, 12],
    [-6, 13],
    [-6, 14],
    [-6, 15],
    [-6, 16],
    [-6, 17],
    [-6, 18],
    [-6, 19],
    [-6, 20],
    [-6, 21],
    [-6, 22],
    [-6, 23],
    [-6, 24],
    [-6, 25],
    [-6, 26],
    [-5, -14],
    [-5, -13],
    [-5, -12],
    [-5, -11],
    [-5, -10],
    [-5, -9],
    [-5, -8],
    [-5, -7],
    [-5, -6],
    [-5, -5],
    [-5, -4],
    [-5, -3],
    [-5, -2],
    [-5, -1],
    [-5, 0],
    [-5, 1],
    [-5, 2],
    [-5, 3],
    [-5, 4],
    [-5, 5],
    [-5, 6],
    [-5, 7],
    [-5, 8],
    [-5, 9],
    [-5, 10],
    [-5, 11],
    [-5, 12],
    [-5, 13],
    [-5, 14],
    [-5, 15],
    [-5, 16],
    [-5, 17],
    [-5, 18],
    [-5, 19],
    [-5, 20],
    [-5, 21],
    [-5, 22],
    [-5, 23],
    [-5, 24],
    [-5, 25],
    [-5, 26],
    [-5, 27],
    [-4, -14],
    [-4, -13],
    [-4, -12],
    [-4, -11],
    [-4, -10],
    [-4, -9],
    [-4, -8],
    [-4, -7],
    [-4, -6],
    [-4, -5],
    [-4, -4],
    [-4, -3],
    [-4, -2],
    [-4, -1],
    [-4, 0],
    [-4, 1],
    [-4, 2],
    [-4, 3],
    [-4, 4],
    [-4, 5],
    [-4, 6],
    [-4, 7],
    [-4, 8],
    [-4, 9],
    [-4, 10],
    [-4, 11],
    [-4, 12],
    [-4, 13],
    [-4, 14],
    [-4, 15],
    [-4, 16],
    [-4, 17],
    [-4, 18],
    [-4, 19],
    [-4, 20],
    [-4, 21],
    [-4, 22],
    [-4, 23],
    [-4, 24],
    [-4, 25],
    [-4, 26],
    [-4, 27],
    [-3, -14],
    [-3, -13],
    [-3, -12],
    [-3, -11],
    [-3, -10],
    [-3, -9],
    [-3, -8],
    [-3, -7],
    [-3, -6],
    [-3, -5],
    [-3, -4],
    [-3, -3],
    [-3, -2],
    [-3, -1],
    [-3, 0],
    [-3, 1],
    [-3, 2],
    [-3, 3],
    [-3, 4],
    [-3, 5],
    [-3, 6],
    [-3, 7],
    [-3, 8],
    [-3, 9],
    [-3, 10],
    [-3, 11],
    [-3, 12],
    [-3, 13],
    [-3, 14],
    [-3, 15],
    [-3, 16],
    [-3, 17],
    [-3, 18],
    [-3, 19],
    [-3, 20],
    [-3, 21],
    [-3, 22],
    [-3, 23],
    [-3, 24],
    [-3, 25],
    [-3, 26],
    [-3, 27],
    [-2, -15],
    [-2, -14],
    [-2, -13],
    [-2, -12],
    [-2, -11],
    [-2, -10],
    [-2, -9],
    [-2, -8],
    [-2, -7],
    [-2, -6],
    [-2, -5],
    [-2, -4],
    [-2, -3],
    [-2, -2],
    [-2, -1],
    [-2, 0],
    [-2, 1],
    [-2, 2],
    [-2, 3],
    [-2, 4],
    [-2, 5],
    [-2, 6],
    [-2, 7],
    [-2, 8],
    [-2, 9],
    [-2, 10],
    [-2, 11],
    [-2, 12],
    [-2, 13],
    [-2, 14],
    [-2, 15],
    [-2, 16],
    [-2, 17],
    [-2, 18],
    [-2, 19],
    [-2, 20],
    [-2, 21],
    [-2, 22],
    [-2, 23],
    [-2, 24],
    [-2, 25],
    [-2, 26],
    [-2, 27],
    [-1, -17],
    [-1, -16],
    [-1, -15],
    [-1, -14],
    [-1, -13],
    [-1, -12],
    [-1, -11],
    [-1, -10],
    [-1, -9],
    [-1, -8],
    [-1, -7],
    [-1, -6],
    [-1, -5],
    [-1, -4],
    [-1, -3],
    [-1, -2],
    [-1, -1],
    [-1, 0],
    [-1, 1],
    [-1, 2],
    [-1, 3],
    [-1, 4],
    [-1, 5],
    [-1, 6],
    [-1, 7],
    [-1, 8],
    [-1, 9],
    [-1, 10],
    [-1, 11],
    [-1, 12],
    [-1, 13],
    [-1, 14],
    [-1, 15],
    [-1, 16],
    [-1, 17],
    [-1, 18],
    [-1, 19],
    [-1, 20],
    [-1, 21],
    [-1, 22],
    [-1, 23],
    [-1, 24],
    [-1, 25],
    [-1, 26],
    [-1, 27],
    [0, -17],
    [0, -16],
    [0, -15],
    [0, -14],
    [0, -13],
    [0, -12],
    [0, -11],
    [0, -10],
    [0, -9],
    [0, -8],
    [0, -7],
    [0, -6],
    [0, -5],
    [0, -4],
    [0, -3],
    [0, -2],
    [0, -1],
    [0, 0],
    [0, 1],
    [0, 2],
    [0, 3],
    [0, 4],
    [0, 5],
    [0, 6],
    [0, 7],
    [0, 8],
    [0, 9],
    [0, 10],
    [0, 11],
    [0, 12],
    [0, 13],
    [0, 14],
    [0, 15],
    [0, 16],
    [0, 17],
    [0, 18],
    [0, 19],
    [0, 20],
    [0, 21],
    [0, 22],
    [0, 23],
    [0, 24],
    [0, 25],
    [0, 26],
    [0, 27],
    [1, -17],
    [1, -16],
    [1, -15],
    [1, -14],
    [1, -13],
    [1, -12],
    [1, -11],
    [1, -10],
    [1, -9],
    [1, -8],
    [1, -7],
    [1, -6],
    [1, -5],
    [1, -4],
    [1, -3],
    [1, -2],
    [1, -1],
    [1, 0],
    [1, 1],
    [1, 2],
    [1, 3],
    [1, 4],
    [1, 5],
    [1, 6],
    [1, 7],
    [1, 8],
    [1, 9],
    [1, 10],
    [1, 11],
    [1, 12],
    [1, 13],
    [1, 14],
    [1, 15],
    [1, 16],
    [1, 17],
    [1, 18],
    [1, 19],
    [1, 20],
    [1, 21],
    [1, 22],
    [1, 23],
    [1, 24],
    [1, 25],
    [1, 26],
    [1, 27],
    [2, -17],
    [2, -16],
    [2, -15],
    [2, -14],
    [2, -13],
    [2, -12],
    [2, -11],
    [2, -10],
    [2, -9],
    [2, -8],
    [2, -7],
    [2, -6],
    [2, -5],
    [2, -4],
    [2, -3],
    [2, -2],
    [2, -1],
    [2, 0],
    [2, 1],
    [2, 2],
    [2, 3],
    [2, 4],
    [2, 5],
    [2, 6],
    [2, 7],
    [2, 8],
    [2, 9],
    [2, 10],
    [2, 11],
    [2, 12],
    [2, 13],
    [2, 14],
    [2, 15],
    [2, 16],
    [2, 17],
    [2, 18],
    [2, 19],
    [2, 20],
    [2, 21],
    [2, 22],
    [2, 23],
    [2, 24],
    [2, 25],
    [2, 26],
    [3, -17],
    [3, -16],
    [3, -15],
    [3, -14],
    [3, -13],
    [3, -12],
    [3, -11],